year,section,field,label,raw_preview
2020-2021,H,H2,", H2A, and H6 below:","H2, H2A, and H6 below: Which needs-analysis methodology does your institution use in awarding institutional aid? (Formerly H3) X Federal methodology (FM) Institutional methodology (IM) Both FM and IM Non-need- Need-based based (Include non- (Exclude non- need-based aid need-based aid use to meet use"
2020-2021,H,H2A,Number of Enrolled Students Awarded Non-need-based Scholarships and Grants: List the number,H2A Number of Enrolled Students Awarded Non-need-based Scholarships and Grants: List the number of degree-seeking full-time and less-than-full-time undergraduates who had no financial need and who were awarded institutional non-need-based scholarship or grant aid. • Numbers should reflect the cohort
2020-2021,H,H4,Provide the number of students in the 2020 undergraduate class who started at,"H4 Provide the number of students in the 2020 undergraduate class who started at your institution as first-time students and received a bachelor's degree between 8739 July 1, 2019 and June 30, 2020. Exclude students who transferred into your institution. CDS-H Page 22 The Ohio State University--Colu"
2020-2021,H,H5,". Number and percent of students in class (defined in H4 above) borrowing from federal, non-federal,","H5. Number and percent of students in class (defined in H4 above) borrowing from federal, non-federal, and any loan sources, and the average (or mean) amount borrowed. • The “Average per-undergraduate-borrower cumulative principal borrowed,” is designed to provide better information about student bo"
2020-2021,H,H6,Indicate your institution’s policy regarding institutional scholarship and grant aid for undergraduate degree-,H6 Indicate your institution’s policy regarding institutional scholarship and grant aid for undergraduate degree- seeking nonresident aliens: Institutional need-based scholarship or grant aid is available X Institutional non-need-based scholarship or grant aid is available Institutional scholarship 
2020-2021,H,H7,Check off all financial aid forms nonresident alien first-year financial aid applicants must submit:,H7 Check off all financial aid forms nonresident alien first-year financial aid applicants must submit: Institution’s own financial aid form CSS/Financial Aid PROFILE International Student’s Financial Aid Application International Student’s Certification of Finances X Other (specify): Institution’s 
2020-2021,H,H8,Check off all financial aid forms domestic first-year (freshman) financial aid applicants must submit:,H8 Check off all financial aid forms domestic first-year (freshman) financial aid applicants must submit: X FAFSA Institution's own financial aid form CSS/Financial Aid PROFILE State aid form Noncustodial PROFILE Business/Farm Supplement Other (specify):
2020-2021,H,H9,Indicate filing dates for first-year (freshman) students:,H9 Indicate filing dates for first-year (freshman) students: Priority date for filing required financial aid forms 1-Feb Deadline for filing required financial aid forms: No deadline for filing required forms (applications processed on a rolling basis)
2020-2021,H,H10,Indicate notification dates for first-year (freshman) students (answer a or b):,"H10 Indicate notification dates for first-year (freshman) students (answer a or b): a) Students notified on or about (date): 15-Mar b) Students notified on a rolling basis: Yes No If yes, starting date:"
2020-2021,H,H11,Indicate reply dates:,H11 Indicate reply dates: Students must reply by (date): 1-May or within _______ weeks of notification. 4 Types of Aid Available Please check off all types of aid available to undergraduates at your institution:
2020-2021,H,H12,Loans,H12 Loans x Direct Subsidized Stafford Loans x Direct Unsubsidized Stafford Loans x Direct PLUS Loans Federal Perkins Loans x Federal Nursing Loans x State Loans x College/university loans from institutional funds Other (specify):
2020-2021,H,H13,Need Based Scholarships and Grants,H13 Need Based Scholarships and Grants x Federal Pell x SEOG x State scholarships/grants x Private scholarships x College/university scholarship or grant aid from institutional funds United Negro College Fund Federal Nursing Scholarship Other (specify): CDS-H Page 24 The Ohio State University--Colum
2020-2021,H,H14,Check off criteria used in awarding institutional aid. Check all that apply.,H14 Check off criteria used in awarding institutional aid. Check all that apply. Non-Need Based Need-Based Academics x x Alumni affiliation x x Art x x Athletics x x Job skills x x ROTC x Leadership x x Minority status x x Music/drama x x Religious affiliation State/district residency x x
2020-2021,H,H15,"If your institution has recently implemented any major financial aid policy, program, or","H15 If your institution has recently implemented any major financial aid policy, program, or initiative to make your institution more affordable to incoming students such as replacing loans with grants, or waiving costs for families below a certain income level please provide details below: Are thes"
2020-2021,J,J1,"Degrees conferred between July 1, 2019 and June 30, 2020","J1 Degrees conferred between July 1, 2019 and June 30, 2020 For each of the following discipline areas, provide the percentage of diplomas/certificates, associate, and bachelor’s degrees awarded. To determine the percentage, use majors, not headcount (e.g., students with one degree but a double majo"
