year,section,field,label,raw_preview
2023-2024,A,A0,. Respondent Information (not for publication),A0. Respondent Information (not for publication) First Name: Sean Last Name: McLaughlin Title: Reporting and Analytics Senior Analyst Office: Institutional Research and Planning Address: 15 E. 15th Avenue City: Columbus State: Ohio Zip: 43210 Country: United States Phone Number: 614-247-0123 Extensi
2023-2024,A,A0A,. Comments About CDS (not for publication),"A0A. Comments About CDS (not for publication) We invite you to indicate if there are items on the CDS for which you cannot use the requested analytic convention, cannot provide data for the cohort requested, whose methodology is unclear, or about which you have questions or comments in general. This"
2023-2024,A,A1,. Address Information,"A1. Address Information Please enter general institution information below: Name of College or University The Ohio State Univeristy Street Address: Student Academic Services Building, 281 West Lane City: Columbus State: Ohio Zip: 43210 Country: United States Main Institution Phone Number: (614) 292-"
2023-2024,A,A2,. Source of Institutional Control: (click to select from dropdown),A2. Source of Institutional Control: (click to select from dropdown) Public
2023-2024,A,A3,. Classify your undergraduate institution: (click to select from dropdown),A3. Classify your undergraduate institution: (click to select from dropdown) Coeducational
2023-2024,A,A4,. Academic year calendar: (click to select from dropdown),A4. Academic year calendar: (click to select from dropdown) Semester
2023-2024,A,A4A,. Describe if calendar differs by program or other:,A4A. Describe if calendar differs by program or other: A5. Degrees offered by your institution (select all that apply). Certificate Master's Diploma Post-Master's certificate Associate Doctoral degree - research/scholarship Terminal Doctoral degree - professional practice Transfer Doctoral degree - 
2023-2024,A,A6,". Diversity, Equity, and Inclusion","A6. Diversity, Equity, and Inclusion If you have a diversity, equity, and inclusion office or department, please provide the URL of the corresponding Web page: www.odi.osu.edu END OF SECTION A"
2023-2024,B,B1,. Institutional Enrollment,"B1. Institutional Enrollment Provide numbers of students for each of the following categories as of the institution’s official fall reporting date or as of October 15, 2023. 1. Report students formaly designated as ""first professional"" in the graduate counts. 2. If your institution collects and repo"
2023-2024,B,B2,. Enrollment by Racial/Ethnic Category,"B2. Enrollment by Racial/Ethnic Category Provide numbers of undergraduate students for each of the following categories as of the institution’s official fall reporting date or as of October 15, 2023. 1. Include international students only in the category ""Nonresidents."" 2. Complete the “Total Underg"
2023-2024,B,B3,. Persistence / Degrees,"B3. Persistence / Degrees Number of degrees awarded by your institution from July 1, 2022, to June 30, 2023. Certificate/Diploma 171.0 Associate's Degrees 771.0 Bachelor's Degrees 11,477.0 Post-Bachelor's Degrees 254.0 Master's Degrees 2,947.0 Post-Master's Degrees 0.0 Doctoral degree - research/sch"
2023-2024,B,B12,". Initial cohort, total of first-time, full-time degree/certificate-seeking","B12. Initial cohort, total of first-time, full-time degree/certificate-seeking students:"
2023-2024,B,B13,". Of the initial cohort, how many did not persist and did not graduate for","B13. Of the initial cohort, how many did not persist and did not graduate for any of the following reasons: (report total allowable exclusions) - Deceased - Permanently Disabled - Armed Forces - Foreign Aid Service of the Federal Government - Official church missions"
2023-2024,B,B14,". Final cohort, after adjusting for allowable exclusions:","B14. Final cohort, after adjusting for allowable exclusions: 0.0 0.0"
2023-2024,B,B15,. Completers of programs of less than two years duration (total):,B15. Completers of programs of less than two years duration (total):
2023-2024,B,B16,. Completers of programs of less than two years within 150 percent of,B16. Completers of programs of less than two years within 150 percent of normal time:
2023-2024,B,B17,. Completers of programs of at least two but less than four years (total):,B17. Completers of programs of at least two but less than four years (total):
2023-2024,B,B18,. Completers of programs of at least two but less than four-years within,B18. Completers of programs of at least two but less than four-years within 150 percent of normal time:
2023-2024,B,B19,. Total transfers-out (within three years) to other institutions:,B19. Total transfers-out (within three years) to other institutions:
2023-2024,B,B20,. Total transfers to two-year institutions:,B20. Total transfers to two-year institutions: B21. Total transfers to four-year institutions:
2023-2024,B,B22,. Retention Rates,"B22. Retention Rates Report for the cohort of all full-time, first-time bachelor’s (or equivalent) degree-seeking undergraduate students who entered in Fall 2022 (or the preceding summer term). The initial cohort may be adjusted for students who departed for the following reasons: *Death *Permanent "
2023-2024,C,C1,". Applications: First-time, First-year Students","C1. Applications: First-time, First-year Students Provide the number of degree-seeking, first-time, first-year students who applied, were admitted, and enrolled (full- or part-time) in Fall 2023. - Include early decision, early action, and students who began studies during summer in this cohort. - A"
2023-2024,C,C2,". Applications: First-time, First-year Wait-Listed Students","C2. Applications: First-time, First-year Wait-Listed Students Students who met admission requirements but whose final admission was contingent on space availablity. Do you have a policy of placing students on a waiting list? Yes Select from the dropdown menu. If yes, please answer the questions belo"
2023-2024,C,C3,. Admission Requirements: High School Completion Requirement,C3. Admission Requirements: High School Completion Requirement Does your institution require high school completion for degree-seeking entering students? Select from dropdown. High school diploma is required and GED is accepted C4. Admission Requirements: General College-Prepatory Program Does your 
2023-2024,C,C5,. Admission Requirements: High School Units Required/Recommended,C5. Admission Requirements: High School Units Required/Recommended Specify the distribution of academic high school course unites required and/or recommend of all or most degree-seeking students using Carnegie units (one unit equals one year of study or its equivalent). If you use a different system
2023-2024,C,C6,. Basis for Selection: Open Admission Policy,"C6. Basis for Selection: Open Admission Policy Does your institution have an open admission policy, under which virtually all secondary school graduates or students with GED equivalency diplomas are admitted without regard to academic record, test scores, or other qualifications? Select the most app"
2023-2024,C,C7,. Basis for Selection: Relative Importance of Factors in Admission Decisions,"C7. Basis for Selection: Relative Importance of Factors in Admission Decisions Please indicate the relative importance of each of the following academic and non-academic factors in your first-time, first-year degree- seeking general admission decisions (not including programs with specific criteria)"
2023-2024,C,C8,. SAT and ACT Policies,"C8. SAT and ACT Policies Does your institution make use of SAT or ACT scores in admissions decisions for first-time, first- year, degree-seeking applicants? If yes, please select the appropriate response from the dropdown menus for each possible option below for admission for Fall 2025. SAT and/or A"
2023-2024,C,C10,. Class Rank Ranges,"C10. Class Rank Ranges Percent of all degree-seeking, first-time, first-year students who had high school class rank within each of the following ranges (report information for those students from whom you collected high school rank information). Class Rank Range Percent Percent in top tenth of high"
2023-2024,C,C11,. High School Grade Point Ranges,"C11. High School Grade Point Ranges Percentage of all enrolled, degree-seeking, first-time, first-year students who had high school grade-point averages within each of the following ranges (using 4.0 scale). 1. Report information only for those students from whom you collected high school GPA. 2. If"
2023-2024,C,C12,. Average High School GPA,"C12. Average High School GPA Average high school GPA of all degree-seeking, first-time, first-year students who submitted GPA: Percent of total first-time, first-year students who submitted high school GPA:"
2023-2024,C,C13,. Application Fee,"C13. Application Fee Does your institution have an application fee? Yes If your institution has waived its application fee for the Fall 2025 application cycle, please select no. If yes, what is the amount of the application fee: $60.00 If yes, can the fee be waived for applicants with financial need"
2023-2024,C,C14,. Application Closing Date,"C14. Application Closing Date Does your institution have an application closing date? Yes If yes, please enter the dates below: Please use the following format: (MM/DD) Application Closing Date (Fall) 2/1 Priority Date"
2023-2024,C,C15,". First-time, first-year student acceptance other than Fall","C15. First-time, first-year student acceptance other than Fall Are first-time, first-year students accepted for terms other than the Fall? Yes"
2023-2024,C,C16,. Admissions Notification to Applicants,"C16. Admissions Notification to Applicants Are notifications to applicants of admission decision sent on a rolling basis? No What date do rolling notifications begin? (MM/DD) If notifications of admission decision are sent by specific date, please enter date: (MM/DD) 3/31"
2023-2024,C,C17,. Reply Policy for Applicants,"C17. Reply Policy for Applicants What is your institution's reply policy for admitted applicants? (select from dropdown menu and related follow-up textbox) Must reply by May 1st (or within set number of weeks if notified thereafter) If you selected reply by May 1st or within a set number of weeks, p"
2023-2024,C,C18,. Deferred Admission,"C18. Deferred Admission Does your institution allow students to postpone enrollment after admission? Yes If yes, what is the maximum period of postponement? 1 year"
2023-2024,C,C19,. Early Admissions,"C19. Early Admissions Does your institution allow high school students to enroll as full-time, No first-time, first-year students one year or more before high school graduation? C20. Common Application (Questions Removed from CDS.) C21. Early Decision Does your institution offer an early decision pl"
2023-2024,D,D1,. Fall Applicants: Transfer Student Enrollment,"D1. Fall Applicants: Transfer Student Enrollment Does your institution enroll transfer students? Yes If NO - Skip to CDS Section E. If yes, may transfer students earn advanced standing credit by transferring credits earned from course work completed at other colleges/universities? Yes"
2023-2024,D,D2,. Fall Applicants: Student Counts,"D2. Fall Applicants: Student Counts Provide the number of students who applied, were admitted, and enrolled as degree-seeking transfer students in Fall 2023. If your institution collects and reports non-binary gender data, please use the ""Another Gender"" category. Admitted Enrolled Applicants Applic"
2023-2024,D,D3,. Enrollment Terms,D3. Enrollment Terms Please indicate which terms for which transfer students may enroll: (select all that apply) Fall Spring Winter Summer Winter Summer
2023-2024,D,D4,. Transfer Applicants Minimum Credits,"D4. Transfer Applicants Minimum Credits Must a transfer applicant have a minimum number of credits/courses completed No or else must apply as an entering first-year student? If yes, what is the minimum number and the unit type? Number: Unit Type:"
2023-2024,D,D5,. Requirements for Admission,"D5. Requirements for Admission Please indicate if the below items are required, recommended, or not of transfer students to apply for admission: Select from the dropdown menu. High school transcript Required of Some College transcript(s) Required of All Essay or personal statement Not Required Inter"
2023-2024,D,D6,. Minimum High School GPA Required,"D6. Minimum High School GPA Required If a minimum high school grade point average is required of transfer applicants, specificy (on a 4.0) scale: GPA Required:"
2023-2024,D,D7,. Minimum College GPA Required,"D7. Minimum College GPA Required If a minimum college grade point average is required of transfer applicants, specificy (on a 4.0) scale: GPA Required: 2.0 D8. List any other application requirements specific to transfer applicants: 2.0 GPA on 30+ semester hours; applicants with less than 30 sem hrs"
2023-2024,D,D9,. Application Specific Dates,"D9. Application Specific Dates List application priority, closing, notification, and candidate reply dates for transfer students. If applications are reviewed on a continuous or rolling basis, place a check mark in the ""Rolling Admission"" column. Use MM/DD format. Notification Priority Date Closing "
2023-2024,D,D10,. Open Admission Policy,"D10. Open Admission Policy Does an open admission policy, if reported, apply to transfer students? No D11. Additional Requirements Please describe any additional requirements for transfer students, if applicable: Admission standards to selected colleges and majors vary and can be higher than the 2.0"
2023-2024,D,D12,. Lowest Grade Allowable for Transfer Credit,"D12. Lowest Grade Allowable for Transfer Credit Report the lowest grade earned for any course that may be transferred for credit: C- ( in a few cases, a D or D+ may transfer; see Transfer Credit Policy, section III.E.1 at C- https://policies.osu.edu/assets/policies/trans fer-credit-policy.pdf) Lowes"
2023-2024,D,D13,. Maximum Credits Transferred to two-year institutions,D13. Maximum Credits Transferred to two-year institutions Report the maximum number of credits or courses that may be transferred from a two-year institution: Number: n/a Unit Type:
2023-2024,D,D14,. Maximum Credits Transferred to four-year institutions,D14. Maximum Credits Transferred to four-year institutions Report the maximum number of credits or courses that may be transferred from a four-year institution: Number: n/a Unit Type:
2023-2024,D,D15,. Minimum Credits to Earn Associate Degree,D15. Minimum Credits to Earn Associate Degree Report the minimum number of credits that transfer students must complete at your institution to earn an associate degree: Number: n/a
2023-2024,D,D16,. Minimum Credits to Earn Bachelor's Degree,D16. Minimum Credits to Earn Bachelor's Degree Report the minimum number of credits that transfer students must complete at your institution to earn a bachelor's degree: Number: 30 semester hours
2023-2024,D,D17,: Other Credit Policies,D17: Other Credit Policies Please describe any other transfer credit policies:
2023-2024,D,D18,: Military/Veteran Transfer Credits,D18: Military/Veteran Transfer Credits Does your institution accept the following military/veteran transfer credits: (select all that apply) American Council on Education (ACE) DANTES Subject Standardized Tests (DSST) College Level Examination Program (CLEP)
2023-2024,D,D19,: Maximum Credits Transferred - ACE,D19: Maximum Credits Transferred - ACE Report the maximum number of credits or courses that may be transferred based on military education evaluated by the American Council on Education (ACE): Number: n/a Unit Type:
2023-2024,D,D20,": Maximum Credits Transferred - CLEP, DSST","D20: Maximum Credits Transferred - CLEP, DSST Report the maximum number of credits or courses that may be transferred based on Department of Defense supported prior learning assessments (College Level Examination Program (CLEP) or DANTES Subject Standardized Tests (DSST)): Report the maximum number "
2023-2024,D,D22,: Unique Transfer Policies,D22: Unique Transfer Policies Please describe other military/veteran transfer credit policies unique to your institution: END OF SECTION D
2023-2024,E,E1,. Special study options,E1. Special study options Please identify the programs available at your institution. Refer to the glossary for definitions. Select all that apply. Accelerated program Honors program Comprehensive transition and postsecondary program for students with intellectual disabilities Independent study Cros
2023-2024,E,E3,. Required Coursework for Graduation,"E3. Required Coursework for Graduation Please indicate the areas in which all, or most, students are required to complete some course work prior to graduation: Select all that apply. Arts / fine arts Intensive Writing Computer literacy Mathematics English (including composition) Philosophy Foreign l"
2023-2024,F,F1,". First-time, first-year degree-seeking students and undergraduates enrolled","F1. First-time, first-year degree-seeking students and undergraduates enrolled Please complete the table below with the percentages or average age of first-time, first-year degree-seeking students and degree- seeking undergraduates enrolled in Fall 2023 who fit into the following categories: First-t"
2023-2024,F,F3,. ROTC (program offered in cooperation with Reserve Officers' Training Corps) select all that apply.,"F3. ROTC (program offered in cooperation with Reserve Officers' Training Corps) select all that apply. Army ROTC is offered: On Campus At cooperating institution If at cooperating institution, please list institution below: Naval ROTC is offered: Marine Option On Campus At cooperating institution If"
2023-2024,F,F4,. Housing,"F4. Housing Please check all types of college-owned, -operated, or -affiliated housing available for undergraduates at your institution. Apartments for married students Men's residence halls Apartments for single students Special housing for international students Coed residence halls Special housin"
2023-2024,G,G0,. Net Price Calculator URL,"G0. Net Price Calculator URL Please provide the URL of your instititution's net price calculator: https://sfa.osu.edu/incoming-freshmen/about-aid/net-price-calculator For the following sections, please provide 2024-2025 academic year costs of attendance for the following categories that are applicab"
2023-2024,G,G1,". Undergraduate, full-time tuition, required fees, food and housing","G1. Undergraduate, full-time tuition, required fees, food and housing List the typical tuition, required fees, and food and housing for a full-time undergraduate student for the full 2024-2025 academic year. (30 semester hours or 45 quarter hours for institutions that derive annual tuition by multip"
2023-2024,G,G2,. Credits Per Term,G2. Credits Per Term Please enter the number of credits per term a student can take for the stated full-time tuition: Minimum number of credits: 12.0 Maximum number of credits: 18.0
2023-2024,G,G3,. Tuition and Fee Variance by Year of Study,"G3. Tuition and Fee Variance by Year of Study Do tuition and fees vary by year of study (e.g. sophomore, junior, senior)? Yes"
2023-2024,G,G4,. Tuition and Fee Variance by Undergraduate Instructional Program,"G4. Tuition and Fee Variance by Undergraduate Instructional Program Do tuition and fees vary by undergraduate instructional program? Yes If yes, what percent of full-time undergraduates pay more than the tuition and fees reported in G1? 0.0%"
2023-2024,G,G5,. Estimated Expenses for Typical Full-Time Undergraduates,"G5. Estimated Expenses for Typical Full-Time Undergraduates Please provide estimated expenses for a typical full-time undergraduate student: Commuters Commuters Residents (living at home) (not living at home) Books and supplies: $1,030.00 $1,030.00 $1,030.00 Housing only: $10,080.00 Food only: $2,08"
2023-2024,G,G6,. Undergraduate Per-Credit-Hour Charges (tuition only),"G6. Undergraduate Per-Credit-Hour Charges (tuition only) Please enter the undergraduate per-credit-hour charges (tuition only) in the applicable institution type and segment of students: PRIVATE INSTITUTIONS Per-credit-hour charge (tuition only): PUBLIC INSTITUTIONS In-district students, per-credit-"
2023-2024,H,H1,. Aid Awarded to Enrolled Undergraduates,"H1. Aid Awarded to Enrolled Undergraduates Enter total dollar amounts awarded to enrolled full-time and less than full-time degree-seeking undergraduates (using the same cohort reported in CDS Question B1, “total degree-seeking” undergraduates) in the following categories. ✔️If the data being report"
2023-2024,H,H2,. Number of Enrolled Students Awarded Aid,H2. Number of Enrolled Students Awarded Aid List the number of degree-seeking full-time and less-than-full-time undergraduates who applied for and were awarded financial aid from any source. ✔ ️Aid that is non-need-based but that was used to meet need should be counted as need-based aid. ✔ ️Numbers 
2023-2024,H,H2A,. Number of Enrolled Students Awarded Non-Need-Based Scholarships and Grants,H2A. Number of Enrolled Students Awarded Non-Need-Based Scholarships and Grants List the number of degree-seeking full-time and less-than-full-time undergraduates who had no financial need and who were awarded institutional non-need-based scholarship or grant aid. ✔️ Numbers should reflect the cohor
2023-2024,H,H4,. 2023 Undergraduate Class,"H4. 2023 Undergraduate Class Provide the number of students in the 2023 undergraduate class who started at your institution as first-time students and received a bachelor's degree between July 1, 2022 and June 30, 2023. 8,535 Exclude students who transferred into your institution. H5. Number/Percent"
2023-2024,H,H6,. Aid to Undergraduate Degree-Seeking Nonresidents,H6. Aid to Undergraduate Degree-Seeking Nonresidents Report numbers and dollar amounts for the same academic year as checked in item H1.
2023-2024,H,H7,. Process for Nonresident First-Year Students,H7. Process for Nonresident First-Year Students Select all financial aid forms that nonresident first-year financial aid applicants must submit: Institution's own financial aid form CSS Profile Other; please specify. Institution’s own “Affidavit of Financial Support for International Other: Students
2023-2024,H,H8,. Process for First-Year Students,H8. Process for First-Year Students Select all financial aid forms domestic first-year financial aid applicants must submit: FAFSA State aid form Institution's own financial aid form Business/Farm Supplement CSS Profile Other; please enter below. Other:
2023-2024,H,H9,. Filing Dates for First-Year Students,"H9. Filing Dates for First-Year Students Does institution have a deadline for filing required financial aid forms for first-year students? No Select ""no"" if there is no deadline and applications are processed on a rolling basis. Priority date for filing required financial aid forms: (MM/DD) 2/15 Dea"
2023-2024,H,H10,. Notification Dates for First-Year Students,H10. Notification Dates for First-Year Students Please enter the date for only one response below based on whether students are notified on a certain date or notified on a rolling basis. Students are notificed on or about (date): (MM/DD) 3/15 Students are notified on a rolling basis starting (date):
2023-2024,H,H11,. Reply Dates for First-Year Students,H11. Reply Dates for First-Year Students Students must reply by (date): (MM/DD) 5/1 or within (number) of weeks of notification: 4.0
2023-2024,H,H12,. Types of Aid Available - Loans,H12. Types of Aid Available - Loans Please select all types of aid available to undergraduates at your institution: Direct Subsidized Stafford Loans Federal Nursing Loans Direct Unsubsidized Stafford Loans State Loans Direct PLUS Loans College/University loans from institutional funds Direct PLUS Lo
2023-2024,H,H13,. Types of Aid Available - Need-Based Scholarships and Grants,H13. Types of Aid Available - Need-Based Scholarships and Grants Please select all types of aid available to undergraduates at your institution: Federal Pell College/University scholarship or grant aid from institutional funds SEOG United Negro College Fund State scholarship/grants Federal Nursing S
2023-2024,H,H14,. Criteria Used in Awarding Institutional Aid,H14. Criteria Used in Awarding Institutional Aid Please select all criteria used in awarding non-need based institutional aid: Academics Job skills Music/drama Alumni affiliation ROTC Religious affiliation Art Leadership State/district residency Athletics Minority status H14. Criteria Used in Awardi
2023-2024,H,H15,. Affordable Policies,"H15. Affordable Policies If your institution has recently implemented any major financial aid policy, program, or iniative to make your institution more affordable to incoming students such as replacing loans with grants, or waiving costs for families below a certain income level, please provide the"
2023-2024,I,I1,. Instructional Faculty by Category,I1. Instructional Faculty by Category Please report the number of instructional faculty members in each category for Fall 2023. Include faculty who are on your institution’s payroll on the census date your institution uses for IPEDS/AAUP. The following definition of full-time instructional faculty i
2023-2024,I,I2,. Student to Faculty Ratio,"I2. Student to Faculty Ratio 43231/5255 Fall 2023 Student to Faculty Ratio: 15.1 to 1 Ratio is based on number of students: 43,231 Ratio is based on number of faculty: 2,865 I3. Undergraduate Class Size In the table below, please report information about the size of classes and class sections offere"
